{
  "version": "1.0",
  "players": {
    "count": 2
  },
  "state": {
    "variables": [
      {
        "id": "score",
        "scope": "global",
        "type": { "kind": "int", "min": 0, "max": 1 },
        "initial": 0
      }
    ],
    "tokenTypes": [
      {
        "id": "card",
        "attributes": []
      }
    ],
    "zones": [
      {
        "id": "table",
        "tokenType": "card",
        "scope": "global",
        "order": "unordered",
        "visibility": "public"
      },
      {
        "id": "hand",
        "tokenType": "card",
        "scope": "per_player",
        "order": "unordered",
        "visibility": "private"
      }
    ]
  },
  "actions": [
    {
      "id": "inspect",
      "actor": "player",
      "preconditions": {
        "kind": "cmp",
        "op": "<",
        "left": { "kind": "ref", "ref": { "kind": "var", "id": "score" } },
        "right": { "kind": "value", "value": 1 }
      },
      "effects": [
        {
          "kind": "inc",
          "target": { "kind": "var", "id": "score" },
          "amount": 1
        }
      ],
      "targets": [
        {
          "id": "tableCard",
          "kind": "token",
          "selector": {
            "zone": "table",
            "tokenType": "card",
            "count": 1
          }
        },
        {
          "id": "handCard",
          "kind": "token",
          "selector": {
            "zone": "hand",
            "tokenType": "card",
            "player": "self",
            "count": 1
          }
        }
      ]
    }
  ],
  "turn": {
    "scheduler": "round_robin"
  },
  "termination": {
    "conditions": [
      {
        "condition": {
          "kind": "cmp",
          "op": ">=",
          "left": { "kind": "ref", "ref": { "kind": "var", "id": "score" } },
          "right": { "kind": "value", "value": 1 }
        },
        "outcome": {
          "type": "win",
          "players": "active"
        }
      }
    ],
    "maxTurns": 6
  }
}
