{
  "version": "1.0",
  "players": {
    "count": 2
  },
  "state": {
    "variables": [
      {
        "id": "ready",
        "scope": "global",
        "type": { "kind": "int", "min": 0, "max": 1 },
        "initial": 0
      },
      {
        "id": "score",
        "scope": "global",
        "type": { "kind": "int", "min": 0, "max": 2 },
        "initial": 0
      }
    ]
  },
  "actions": [
    {
      "id": "prepare",
      "actor": "player",
      "metadata": { "phase": "setup" },
      "preconditions": {
        "kind": "cmp",
        "op": "==",
        "left": { "kind": "ref", "ref": { "kind": "var", "id": "ready" } },
        "right": { "kind": "value", "value": 0 }
      },
      "effects": [
        {
          "kind": "set",
          "target": { "kind": "var", "id": "ready" },
          "value": 1
        }
      ]
    },
    {
      "id": "score",
      "actor": "player",
      "metadata": { "phase": "main" },
      "preconditions": {
        "kind": "and",
        "left": {
          "kind": "cmp",
          "op": "==",
          "left": { "kind": "ref", "ref": { "kind": "var", "id": "ready" } },
          "right": { "kind": "value", "value": 1 }
        },
        "right": {
          "kind": "cmp",
          "op": "<",
          "left": { "kind": "ref", "ref": { "kind": "var", "id": "score" } },
          "right": { "kind": "value", "value": 2 }
        }
      },
      "effects": [
        {
          "kind": "inc",
          "target": { "kind": "var", "id": "score" },
          "amount": 1
        }
      ]
    }
  ],
  "turn": {
    "scheduler": "round_robin",
    "phases": ["setup", "main"]
  },
  "termination": {
    "conditions": [
      {
        "condition": {
          "kind": "cmp",
          "op": ">=",
          "left": { "kind": "ref", "ref": { "kind": "var", "id": "score" } },
          "right": { "kind": "value", "value": 2 }
        },
        "outcome": {
          "type": "win",
          "players": "active"
        }
      }
    ],
    "maxTurns": 8
  }
}
